{
  "record_type": "cait_source_bundle_v1",
  "contract": {
    "record_type": "cait_computation_contract_v1",
    "scope": "synthetic",
    "episode": "episode-1",
    "study": "holdout",
    "start": 0,
    "end": 10,
    "cutoff": 12,
    "checkpoint_time": 0,
    "basis": "synthetic",
    "interpretation": "as_of",
    "coordinates": [
      {
        "id": "assets",
        "unit": "qualified-artifact",
        "meaning": "asset_stock"
      },
      {
        "id": "service",
        "unit": "qualified-task",
        "meaning": "service_outcome"
      }
    ],
    "receivers": [
      {
        "id": "receiver-1",
        "context": "finite-task",
        "task": "task-1",
        "evaluator": "evaluator-v1",
        "protocol": "holdout-v1",
        "checks": [
          "exact-check"
        ]
      },
      {
        "id": "receiver-2",
        "context": "finite-task",
        "task": "task-1",
        "evaluator": "evaluator-v1",
        "protocol": "holdout-v1",
        "checks": [
          "exact-check"
        ]
      }
    ],
    "arms": [
      "candidate"
    ],
    "scenarios": [
      "joint-a"
    ],
    "opening": [
      {
        "artifact": "cb6667cd59b1de3d366d0e560c8ce754a126af0e2da4e5a06ad8a855e052b377",
        "coordinate": "assets",
        "arm": "candidate",
        "quantity": {
          "joint-a": "1"
        },
        "expires": 100
      },
      {
        "artifact": "27f7d219e461adb956b835bd30041edf372b46c1e5cab4087740397241cb2a63",
        "coordinate": "assets",
        "arm": "candidate",
        "quantity": {
          "joint-a": "1"
        },
        "expires": 100
      }
    ],
    "streams": [
      {
        "id": "journal",
        "arm": "candidate",
        "checkpoint": "c39d75c5426988326e58c908d94a01be5b0bd0825be7ccabbc98aca0d0bb856b",
        "first": 1,
        "last": 5,
        "terminal": "2d6e12b773b9614e7d256b8c1cc7f85c034e4b1f4964d41bb515b6d81ab2ec02"
      }
    ],
    "mandatory_events": [
      "cost-formation",
      "create-child",
      "reuse-child"
    ],
    "mandatory_costs": [
      "physical-1",
      "physical-2",
      "physical-3"
    ],
    "negative_terms_complete": true,
    "allocations": {},
    "cost_units": [
      "work-hour"
    ],
    "resource_limits": {
      "work-hour": {
        "joint-a": "4"
      }
    },
    "valuation": {
      "version": "valuation-v1",
      "target": "assets",
      "rates": {
        "work-hour": {
          "joint-a": "1"
        }
      }
    },
    "operation_budget": 100000,
    "policy": "disjoint-origin-v1:content-dedup:propagate-revocation:half-open"
  },
  "events": [
    {
      "sha256": "2e82e7f70619e85df8a42b14d3b7fe1861e581d0f3f647ba65f27618093d49a3",
      "content": "{\"arm\":\"candidate\",\"contract\":\"8f5c76b2f9f9d9db82081c58794b8e23a50545c599f3a020e2c5e6904ba4dd7d\",\"costs\":[],\"data\":{\"cost_id\":\"physical-1\",\"quantity\":{\"joint-a\":\"1\"},\"stage\":\"formation\",\"unit\":\"work-hour\"},\"dependencies\":[],\"episode\":\"episode-1\",\"evidence\":[],\"id\":\"cost-formation\",\"kind\":\"cost\",\"previous\":\"c39d75c5426988326e58c908d94a01be5b0bd0825be7ccabbc98aca0d0bb856b\",\"recorded\":0,\"scope\":\"synthetic\",\"sequence\":1,\"stream\":\"journal\",\"study\":\"holdout\",\"time\":0}"
    },
    {
      "sha256": "7df8aa0c231b1188a067102164619b0b518b7b0b1fc523ce85a333085344ef5f",
      "content": "{\"arm\":\"candidate\",\"contract\":\"8f5c76b2f9f9d9db82081c58794b8e23a50545c599f3a020e2c5e6904ba4dd7d\",\"costs\":[\"physical-1\"],\"data\":{\"artifact\":\"0afbc7c3c11c0f7d165fc3801ee0a4f400832fcb600a05f20d7d6a2d860711da\",\"coordinate\":\"assets\",\"expires\":100,\"parent_shares\":{\"27f7d219e461adb956b835bd30041edf372b46c1e5cab4087740397241cb2a63\":\"1/2\",\"cb6667cd59b1de3d366d0e560c8ce754a126af0e2da4e5a06ad8a855e052b377\":\"1/2\"},\"parents\":[\"cb6667cd59b1de3d366d0e560c8ce754a126af0e2da4e5a06ad8a855e052b377\",\"27f7d219e461adb956b835bd30041edf372b46c1e5cab4087740397241cb2a63\"],\"quantity\":{\"joint-a\":\"5\"},\"shares\":{\"endogenous\":\"1\",\"external\":\"0\",\"unresolved\":\"0\"}},\"dependencies\":[],\"episode\":\"episode-1\",\"evidence\":[\"check-creation\"],\"id\":\"create-child\",\"kind\":\"create\",\"previous\":\"2e82e7f70619e85df8a42b14d3b7fe1861e581d0f3f647ba65f27618093d49a3\",\"recorded\":1,\"scope\":\"synthetic\",\"sequence\":2,\"stream\":\"journal\",\"study\":\"holdout\",\"time\":1}"
    },
    {
      "sha256": "f73654fc6beebf1f1482d051c84b4c52f8e3f55f1c53319fa8ade79bb39c547d",
      "content": "{\"arm\":\"candidate\",\"contract\":\"8f5c76b2f9f9d9db82081c58794b8e23a50545c599f3a020e2c5e6904ba4dd7d\",\"costs\":[\"physical-1\"],\"data\":{\"artifact\":\"0afbc7c3c11c0f7d165fc3801ee0a4f400832fcb600a05f20d7d6a2d860711da\",\"context\":\"finite-task\",\"coordinate\":\"service\",\"evaluator\":\"evaluator-v1\",\"input\":\"48aed2374cea5f3bbbee1c8742439be758dcc1e999e0e3f0e03c1ee80e3565a0\",\"outcome\":\"success\",\"protocol\":\"holdout-v1\",\"quantity\":{\"joint-a\":\"1\"},\"receiver\":\"receiver-1\",\"task\":\"task-1\"},\"dependencies\":[\"create-child\"],\"episode\":\"episode-1\",\"evidence\":[\"check-creation\"],\"id\":\"reuse-child\",\"kind\":\"use\",\"previous\":\"7df8aa0c231b1188a067102164619b0b518b7b0b1fc523ce85a333085344ef5f\",\"recorded\":2,\"scope\":\"synthetic\",\"sequence\":3,\"stream\":\"journal\",\"study\":\"holdout\",\"time\":2}"
    },
    {
      "sha256": "aa195431a0ab80a3a24d39143a047435092bcf76eca55e3676b2a164977a339a",
      "content": "{\"arm\":\"candidate\",\"contract\":\"8f5c76b2f9f9d9db82081c58794b8e23a50545c599f3a020e2c5e6904ba4dd7d\",\"costs\":[],\"data\":{\"cost_id\":\"physical-2\",\"quantity\":{\"joint-a\":\"3\"},\"stage\":\"transfer\",\"unit\":\"work-hour\"},\"dependencies\":[],\"episode\":\"episode-1\",\"evidence\":[],\"id\":\"cost-transfer\",\"kind\":\"cost\",\"previous\":\"f73654fc6beebf1f1482d051c84b4c52f8e3f55f1c53319fa8ade79bb39c547d\",\"recorded\":3,\"scope\":\"synthetic\",\"sequence\":4,\"stream\":\"journal\",\"study\":\"holdout\",\"time\":3}"
    },
    {
      "sha256": "2d6e12b773b9614e7d256b8c1cc7f85c034e4b1f4964d41bb515b6d81ab2ec02",
      "content": "{\"arm\":\"candidate\",\"contract\":\"8f5c76b2f9f9d9db82081c58794b8e23a50545c599f3a020e2c5e6904ba4dd7d\",\"costs\":[],\"data\":{\"cost_id\":\"physical-3\",\"quantity\":{\"joint-a\":\"3\"},\"stage\":\"maintenance\",\"unit\":\"work-hour\"},\"dependencies\":[],\"episode\":\"episode-1\",\"evidence\":[],\"id\":\"cost-maintenance\",\"kind\":\"cost\",\"previous\":\"aa195431a0ab80a3a24d39143a047435092bcf76eca55e3676b2a164977a339a\",\"recorded\":4,\"scope\":\"synthetic\",\"sequence\":5,\"stream\":\"journal\",\"study\":\"holdout\",\"time\":4}"
    }
  ],
  "evidence": [
    {
      "sha256": "f02146c277f8f32645667dc319fb0961aa37aabc9dcd5696c989aa550eaafdc6",
      "content": "{\"arm\":\"candidate\",\"artifact\":\"0afbc7c3c11c0f7d165fc3801ee0a4f400832fcb600a05f20d7d6a2d860711da\",\"blocking_defeaters\":[],\"check\":\"exact-check\",\"context\":\"finite-task\",\"cost_ids\":[\"physical-1\"],\"dependencies\":[],\"evaluator\":\"evaluator-v1\",\"id\":\"check-creation\",\"outcome\":\"pass\",\"protocol\":\"holdout-v1\",\"receiver\":\"receiver-1\",\"scope\":\"synthetic\",\"valid_from\":0,\"valid_until\":100}"
    }
  ],
  "models": [
    {
      "sha256": "c2b6eb80b42c07d77722aa78f08263d0f018ea4a70e9220950553cf4f12273f9",
      "content": "{\"complete\":true,\"contract\":\"8f5c76b2f9f9d9db82081c58794b8e23a50545c599f3a020e2c5e6904ba4dd7d\",\"episode\":\"episode-1\",\"evidence_basis\":\"synthetic\",\"exposure\":\"registered-parent-cohort\",\"external_boundary\":\"external-offspring-excluded\",\"family\":[{\"lower\":[[\"2\"]],\"upper\":[[\"3\"]]}],\"interpretation\":\"births_only\",\"iterations\":3,\"kind\":\"expected_offspring\",\"lower_witness\":{\"block\":[],\"bound\":\"2\",\"vector\":[\"1\"]},\"orientation\":\"rows-child-columns-parent\",\"record_type\":\"cait_reproduction_model_v1\",\"retention\":\"parents-excluded\",\"scope\":\"synthetic\",\"sources\":[\"create-child\"],\"time_basis\":\"generation\",\"types\":[\"qualified-artifact\"],\"upper_witness\":null,\"valid_from\":0,\"valid_until\":10}"
    }
  ]
}
