{
  "record_type": "cait_source_bundle_v1",
  "contract": {
    "record_type": "cait_computation_contract_v1",
    "scope": "synthetic",
    "episode": "episode-1",
    "study": "holdout",
    "start": 0,
    "end": 10,
    "cutoff": 12,
    "checkpoint_time": 0,
    "basis": "synthetic",
    "interpretation": "corrected",
    "coordinates": [
      {
        "id": "assets",
        "unit": "qualified-artifact",
        "meaning": "asset_stock"
      },
      {
        "id": "service",
        "unit": "qualified-task",
        "meaning": "service_outcome"
      }
    ],
    "receivers": [
      {
        "id": "receiver-1",
        "context": "finite-task",
        "task": "task-1",
        "evaluator": "evaluator-v1",
        "protocol": "holdout-v1",
        "checks": [
          "exact-check"
        ]
      },
      {
        "id": "receiver-2",
        "context": "finite-task",
        "task": "task-1",
        "evaluator": "evaluator-v1",
        "protocol": "holdout-v1",
        "checks": [
          "exact-check"
        ]
      }
    ],
    "arms": [
      "candidate"
    ],
    "scenarios": [
      "joint-a"
    ],
    "opening": [
      {
        "artifact": "cb6667cd59b1de3d366d0e560c8ce754a126af0e2da4e5a06ad8a855e052b377",
        "coordinate": "assets",
        "arm": "candidate",
        "quantity": {
          "joint-a": "1"
        },
        "expires": 100
      },
      {
        "artifact": "27f7d219e461adb956b835bd30041edf372b46c1e5cab4087740397241cb2a63",
        "coordinate": "assets",
        "arm": "candidate",
        "quantity": {
          "joint-a": "1"
        },
        "expires": 100
      }
    ],
    "streams": [
      {
        "id": "journal",
        "arm": "candidate",
        "checkpoint": "c39d75c5426988326e58c908d94a01be5b0bd0825be7ccabbc98aca0d0bb856b",
        "first": 1,
        "last": 4,
        "terminal": "f1941e8fc85a09cc6c3651be4e070c419c7166980c4110885c515c8404df225c"
      }
    ],
    "mandatory_events": [
      "cost-formation",
      "create-child",
      "reuse-child"
    ],
    "mandatory_costs": [
      "physical-1"
    ],
    "negative_terms_complete": true,
    "allocations": {},
    "cost_units": [
      "work-hour"
    ],
    "resource_limits": {
      "work-hour": {
        "joint-a": "100"
      }
    },
    "valuation": {
      "version": "valuation-v1",
      "target": "assets",
      "rates": {
        "work-hour": {
          "joint-a": "1"
        }
      }
    },
    "operation_budget": 100000,
    "policy": "disjoint-origin-v1:content-dedup:propagate-revocation:half-open"
  },
  "events": [
    {
      "sha256": "33f68e37e63fc774ddb730f27c799e5ce5db6a9888a44582c208d8703ad267fd",
      "content": "{\"arm\":\"candidate\",\"contract\":\"e4f765139cab4b0483d7fcee87427620409f34c63c4d2277125857390cafeae3\",\"costs\":[],\"data\":{\"cost_id\":\"physical-1\",\"quantity\":{\"joint-a\":\"1\"},\"stage\":\"formation\",\"unit\":\"work-hour\"},\"dependencies\":[],\"episode\":\"episode-1\",\"evidence\":[],\"id\":\"cost-formation\",\"kind\":\"cost\",\"previous\":\"c39d75c5426988326e58c908d94a01be5b0bd0825be7ccabbc98aca0d0bb856b\",\"recorded\":0,\"scope\":\"synthetic\",\"sequence\":1,\"stream\":\"journal\",\"study\":\"holdout\",\"time\":0}"
    },
    {
      "sha256": "6cd1a4a0a75e084f9169bb7bb231ffc0dd57b5ffeb1e837122590573f1da341a",
      "content": "{\"arm\":\"candidate\",\"contract\":\"e4f765139cab4b0483d7fcee87427620409f34c63c4d2277125857390cafeae3\",\"costs\":[\"physical-1\"],\"data\":{\"artifact\":\"0afbc7c3c11c0f7d165fc3801ee0a4f400832fcb600a05f20d7d6a2d860711da\",\"coordinate\":\"assets\",\"expires\":100,\"parent_shares\":{\"27f7d219e461adb956b835bd30041edf372b46c1e5cab4087740397241cb2a63\":\"1/2\",\"cb6667cd59b1de3d366d0e560c8ce754a126af0e2da4e5a06ad8a855e052b377\":\"1/2\"},\"parents\":[\"cb6667cd59b1de3d366d0e560c8ce754a126af0e2da4e5a06ad8a855e052b377\",\"27f7d219e461adb956b835bd30041edf372b46c1e5cab4087740397241cb2a63\"],\"quantity\":{\"joint-a\":\"5\"},\"shares\":{\"endogenous\":\"1\",\"external\":\"0\",\"unresolved\":\"0\"}},\"dependencies\":[],\"episode\":\"episode-1\",\"evidence\":[\"check-creation\"],\"id\":\"create-child\",\"kind\":\"create\",\"previous\":\"33f68e37e63fc774ddb730f27c799e5ce5db6a9888a44582c208d8703ad267fd\",\"recorded\":1,\"scope\":\"synthetic\",\"sequence\":2,\"stream\":\"journal\",\"study\":\"holdout\",\"time\":1}"
    },
    {
      "sha256": "a18c22a4e7d77fcdd2d4736849ac7dd896aa35fa9be5a373b8f7951ad166cfa6",
      "content": "{\"arm\":\"candidate\",\"contract\":\"e4f765139cab4b0483d7fcee87427620409f34c63c4d2277125857390cafeae3\",\"costs\":[\"physical-1\"],\"data\":{\"artifact\":\"0afbc7c3c11c0f7d165fc3801ee0a4f400832fcb600a05f20d7d6a2d860711da\",\"context\":\"finite-task\",\"coordinate\":\"service\",\"evaluator\":\"evaluator-v1\",\"input\":\"48aed2374cea5f3bbbee1c8742439be758dcc1e999e0e3f0e03c1ee80e3565a0\",\"outcome\":\"success\",\"protocol\":\"holdout-v1\",\"quantity\":{\"joint-a\":\"1\"},\"receiver\":\"receiver-1\",\"task\":\"task-1\"},\"dependencies\":[\"create-child\"],\"episode\":\"episode-1\",\"evidence\":[\"check-creation\"],\"id\":\"reuse-child\",\"kind\":\"use\",\"previous\":\"6cd1a4a0a75e084f9169bb7bb231ffc0dd57b5ffeb1e837122590573f1da341a\",\"recorded\":2,\"scope\":\"synthetic\",\"sequence\":3,\"stream\":\"journal\",\"study\":\"holdout\",\"time\":2}"
    },
    {
      "sha256": "f1941e8fc85a09cc6c3651be4e070c419c7166980c4110885c515c8404df225c",
      "content": "{\"arm\":\"candidate\",\"contract\":\"e4f765139cab4b0483d7fcee87427620409f34c63c4d2277125857390cafeae3\",\"costs\":[],\"data\":{\"quantity\":{\"joint-a\":\"2\"},\"reason\":\"measurement-correction\",\"target\":\"create-child\"},\"dependencies\":[\"create-child\"],\"episode\":\"episode-1\",\"evidence\":[],\"id\":\"correct-child\",\"kind\":\"correct\",\"previous\":\"a18c22a4e7d77fcdd2d4736849ac7dd896aa35fa9be5a373b8f7951ad166cfa6\",\"recorded\":5,\"scope\":\"synthetic\",\"sequence\":4,\"stream\":\"journal\",\"study\":\"holdout\",\"time\":5}"
    }
  ],
  "evidence": [
    {
      "sha256": "f02146c277f8f32645667dc319fb0961aa37aabc9dcd5696c989aa550eaafdc6",
      "content": "{\"arm\":\"candidate\",\"artifact\":\"0afbc7c3c11c0f7d165fc3801ee0a4f400832fcb600a05f20d7d6a2d860711da\",\"blocking_defeaters\":[],\"check\":\"exact-check\",\"context\":\"finite-task\",\"cost_ids\":[\"physical-1\"],\"dependencies\":[],\"evaluator\":\"evaluator-v1\",\"id\":\"check-creation\",\"outcome\":\"pass\",\"protocol\":\"holdout-v1\",\"receiver\":\"receiver-1\",\"scope\":\"synthetic\",\"valid_from\":0,\"valid_until\":100}"
    }
  ],
  "models": [
    {
      "sha256": "a061eb6008f06841d49acfca72f6445bdb42a509e538b4f9ddce908b1dde8c16",
      "content": "{\"complete\":true,\"contract\":\"e4f765139cab4b0483d7fcee87427620409f34c63c4d2277125857390cafeae3\",\"episode\":\"episode-1\",\"evidence_basis\":\"synthetic\",\"exposure\":\"registered-parent-cohort\",\"external_boundary\":\"external-offspring-excluded\",\"family\":[{\"lower\":[[\"2\"]],\"upper\":[[\"3\"]]}],\"interpretation\":\"births_only\",\"iterations\":3,\"kind\":\"expected_offspring\",\"lower_witness\":{\"block\":[],\"bound\":\"2\",\"vector\":[\"1\"]},\"orientation\":\"rows-child-columns-parent\",\"record_type\":\"cait_reproduction_model_v1\",\"retention\":\"parents-excluded\",\"scope\":\"synthetic\",\"sources\":[\"create-child\"],\"time_basis\":\"generation\",\"types\":[\"qualified-artifact\"],\"upper_witness\":null,\"valid_from\":0,\"valid_until\":10}"
    }
  ]
}
